{
  "schemaVersion": "2",
  "releaseId": "2026-07-29.3-preview",
  "status": "BLOCKED_NOT_OPERATIONAL",
  "productionWriteEnabled": false,
  "mainnetEnabled": false,
  "profile": {
    "mandatoryGates": 37,
    "passedGates": 0,
    "requiredClaims": 93,
    "acceptedClaims": 0
  },
  "metrics": {
    "prototypeFlows": 12,
    "prototypeViewports": 6,
    "prototypeCases": 288,
    "knownLoopholes": 436,
    "securityInvariants": 268,
    "loopholeRegressionCases": 97
  },
  "sourceCommit": null,
  "sourceTreeDigest": null,
  "artifactDigest": null
}
