{"artifactDigest":"sha256:8ba9a21897b624dad3d2b4429843f0e7161511020f0ed625838d9ca2c2464d46","mainnetEnabled":false,"metrics":{"knownLoopholes":436,"loopholeRegressionCases":97,"prototypeCases":288,"prototypeFlows":12,"prototypeViewports":6,"securityInvariants":268},"productionWriteEnabled":false,"profile":{"acceptedClaims":0,"mandatoryGates":37,"passedGates":0,"requiredClaims":93},"releaseId":"2026-07-29.3-preview","schemaVersion":"2","sourceCommit":null,"sourceTreeDigest":"sha256:ea4fb77917638ce38173329ca5c51a2eb41f91ffaf745d5e61abb0bc1687fdf7","status":"BLOCKED_NOT_OPERATIONAL"}
